name,url,,topic1,topic2,topic3,topic4,topic5
Insight Crime,https://insightcrime.org/,,,,,,
United States Institute of Peace,https://www.usip.org/publications,,,,,,
Pew Research,https://www.pewresearch.org/publications/,,,,,,
ProPublica,https://www.propublica.org/,,,,,,
Associated Press,https://apnews.com/,,,,,,
Reuters,https://www.reuters.com/,,,,,,
Al Jazeera,https://www.aljazeera.com/news/,,,,,,
Brookings Institute,https://www.brookings.edu/research-commentary/,,,,,,
Business & Human Rights Resource Center,https://www.business-humanrights.org/en/latest-news/?&language=en,,,,,,
Armed Conflict Location & Event Data,https://acleddata.com/,,,,,,
Institute for the Study of War,https://www.understandingwar.org/,,,,,,
Carnegie Endowment For International Peace,https://carnegieendowment.org/research?lang=en,,,,,,
Center for Strategic and International Studies,https://www.csis.org/analysis,,,,,,
Committee for a Responsible Federal Budget,https://www.crfb.org/,,,,,,
National Security Archive,https://nsarchive.gwu.edu/,,,,,,
The Marshall Project,https://www.themarshallproject.org/,,,,,,
The Southern Poverty Law Center,https://www.splcenter.org/,,,,,,
Carnegie Middle East Center,https://carnegieendowment.org/middle-east?lang=en,,,,,,
AP-NORC,https://apnorc.org/,,,,,,
Lawfare,https://www.lawfaremedia.org/,,,,,,
The National Academies Press,https://nap.nationalacademies.org/,,,,,,
Transportation Research Board,https://www.trb.org/Publications/PubsTRBPublicationsbySeries.aspx,,,,,,
American Institute in Taiwan,https://www.ait.org.tw/,,,,,,
Heritage Foundation,https://www.heritage.org/,,,,,,
Migration Policy Institute,https://www.migrationpolicy.org/research,,,,,,
OVD-Info,https://en.ovdinfo.org/,,,,,,
Peter G. Peterson Foundation,https://www.pgpf.org/the-latest,,,,,,
Center for Federal Tax Policy,https://taxfoundation.org/research/federal-tax/,,,,,,
Center for State Tax Policy,https://taxfoundation.org/research/state-tax/,,,,,,
CATO Institute,https://www.cato.org/search/category/study,,,,,,
US Customs and Border Protection,https://www.cbp.gov/newsroom,,,,,,
Tel Aviv University: Center for Security Studies,https://www.inss.org.il/publication/,,,,,,
Asharq Al-Awsat,https://aawsat.com/,,,,,,
Africa Center for Strategic Studies,https://africacenter.org/,,,,,,
Institute on Taxation and Economic Policy,https://itep.org/category/publications/,,,,,,
Economic Policy Institute,https://www.epi.org/publications/,,,,,,
Voice of Belarus,https://www.voiceofbelarus.org/,,,,,,
Freedom House,https://freedomhouse.org/perspectives,,,,,,
Amnesty International,https://www.amnesty.org/en/latest/,,,,,,
World Liberty Congress,https://worldlibertycongress.org/category/blog/articles/,,,,,,
El Colombiano,https://m.elcolombiano.com/,,,,,,
Primicias,https://www.primicias.ec/,,,,,,
Brennan Center,"https://www.brennancenter.org/news-analysis/?langcode=en&type=analysis,fellows,explainer,q&a&nid=!11459,!11461,!11460,!11465&",,,,,,
Voting Rights Lab,https://votingrightslab.org/analysis/?referral=tracker_website&_gl=1*qywn1y*_ga*MTUwMDYxNjI2Ni4xNzMxMjYwMTE4*_ga_08JKXKYXTL*MTczMTI2MDExNy4xLjAuMTczMTI2MDExOC41OS4wLjA.,,,,,,
Myanmar Now,https://myanmar-now.org/en/,,,,,,
The Irrawaddy,https://www.irrawaddy.com/,,,,,,
Iraqi News,https://www.iraqinews.com/,,,,,,
Politico,https://www.politico.com/,,,,,,
Politifact,https://www.politifact.com/elections/,,,,,,
Federal News Network,https://federalnewsnetwork.com/,,,,,,
American Compass,https://americancompass.org/,,,,,,
The Soufan Center,https://thesoufancenter.org/research/,,,,,,
Institute for War and Peace Reporting,https://iwpr.net/,,,,,,
Haaretz,https://www.haaretz.com/,,,,,,
Rice University: Baker Institute,https://www.bakerinstitute.org/research-library,,,,,,
Tasnim News,https://www.tasnimnews.com/,,,,,,
Stockholm International Peace Research Institute,https://www.sipri.org/,,,,,,
The Harvard Gazette,https://news.harvard.edu/gazette/archives/,,,,,,
Al Ahkbar,https://al-akhbar.com/,,,,,,
Small Arms Survey,https://www.smallarmssurvey.org/news/highlights,,,,,,
Médecins Sans Frontières,https://www.msf.org/latest-portal,,,,,,
Association for a More Just Society,https://www.asj-us.org/stories,,,,,,
Israel Hayom,https://www.israelhayom.co.il/,,,,,,
Al Hadath,https://www.alhadath.net/,,,,,,
Tabula,https://tabula.ge/en,,,,,,
Syria Direct,https://syriadirect.org/,,,,,,
Campaign Legal Center,https://campaignlegal.org/latest,,voting,,,,
Citizens for Responsibility and Ethics in Washington,https://www.citizensforethics.org/news/,,investigative,,,,
Congressional Research Service,https://www.congress.gov/crs-products,,,,,,
Crisis Group,https://www.crisisgroup.org/latest-updates,,,,,,
The African Centre for the Constructive Resolution of Disputes,https://www.accord.org.za/articles/,,,,,,
Imani Africa,https://imaniafrica.org/news/,,,,,,
Institute for Security Studies,https://issafrica.org/iss-today,,,,,,
The Nigerian Economic Summit Group,https://www.nesgroup.org/research,,,,,,
South African Institute of International Affairs,https://saiia.org.za/,,,,,,
Corruption Watch,https://www.corruptionwatch.org.za/news-views/,,,,,,
Transparency International,https://www.transparency.org/en/news,,,,,,
Afrobarometer,https://www.afrobarometer.org/media-releases/,,,,,,
Organized Crime and Corruption Reporting Project,https://www.occrp.org/en/news,,,,,,
Institute for Justice and Reconciliation,https://www.ijr.org.za/news/,,,,,,
Council on Foreign Relations,https://www.cfr.org/,,foreign,,,,
SCOTUS Blog,https://www.scotusblog.com/,,judicial,,,,
Law360,https://www.law360.com/,,judicial,,,,
Jurist,https://www.jurist.org/,,judicial,,,,
ABA Journal,https://www.abajournal.com/,,judicial,,,,
Empirical SCOTUS,https://empiricalscotus.com/,,judicial,,,,
Balkinization,https://balkin.blogspot.com/,,,,,,
Government Executive,https://www.govexec.com/,,federal,,,,
Next Gov,https://www.nextgov.com/,,government,,,,
Roll Call,https://rollcall.com/,,congressional,,,,
Defense News,https://www.defensenews.com/,,defense,,,,
FedScoop,https://fedscoop.com/,,federal,,,,
Health Affairs,https://www.healthaffairs.org/toc/hlthaff/current,,health,,,,
RAND Coorporation,https://www.rand.org/pubs.html,,defense,,,,
Center for a New American Security,https://www.cnas.org/press,,defense,,,,
Jane's Defence Weekly,https://www.janes.com/osint-insights/defence-news,,defense,,,,
Just Security,https://www.justsecurity.org/,,analysis,,,,
Common Cause,https://www.commoncause.org/research-and-resources/,,analysis,,,,
Immigration Policy Tracking Project,https://immpolicytracking.org/policies/?all=True&category=enforcement&agency=&department=,,immigration,,,,
Inc.,https://www.inc.com/,,economic,,,,
Labor Notes,https://www.labornotes.org/archives,,economic,,,,
U.S. Small Business Administration,https://www.sba.gov/articles?keyword=&article_type=All&field_article_authoring_office_target_id=All&langcode=en,,,,,,
American Federation of Labor and Congress of Industrial Organizations,https://aflcio.org/press/releases,,,,,,
U.S. Department of Health and Human Services: Office of Inspector General,https://oig.hhs.gov/reports/all/,,,,,,
U.S. Department of Health and Human Services: Press Releases,https://www.hhs.gov/about/news/index.html,,,,,,
Center on Budget and Policy Priorities,https://www.cbpp.org/comprehensive,,,,,,
Novaya Gazeta: Europe,https://novayagazeta.eu/,,,,,,
Novaya Gazeta: Russia,https://novayagazeta.ru/,,,,,,
The Leadership Conference on Civil and Human Rights,https://civilrights.org/press/,,,,,,
Snopes,https://www.snopes.com/,,,,,,
Politifact,https://www.politifact.com/,,,,,,
Fact Check,https://www.factcheck.org/,,,,,,
Media Bias/Fact Check,https://mediabiasfactcheck.com/,,,,,,
Reuters Fact Check,https://www.reuters.com/fact-check/,,,,,,
AP Fact Check,https://apnews.com/ap-fact-check,,,,,,
White House Presidential Actions,https://www.whitehouse.gov/presidential-actions/,,,,,,
American Oversight,https://americanoversight.org/our-work/our-latest/,,,,,,
Chatham House,https://www.chathamhouse.org/,,,,,,
House Agriculture Committee: Website News,https://agriculture.house.gov/news/documentquery.aspx,,,,,,
House Agriculture Committee: Committee Activity,https://www.congress.gov/committee/house-agriculture/hsag00,,,,,,
House Armed Services Committee: Website News,https://armedservices.house.gov/news/,,,,,,
House Armed Services Committee: Committee Activity,https://www.congress.gov/committee/house-armed-services/hsas00,,,,,,
House Appropriations Committee: Website News,https://appropriations.house.gov/news,,,,,,
House Appropriations Committee: Committee Activity,https://www.congress.gov/committee/house-appropriations/hsap00,,,,,,
House Budget Committee: Website News,https://budget.house.gov/news,,,,,,
House Budget Committee: Committee Activity,https://www.congress.gov/committee/house-budget/hsbu00,,,,,,
House Education and Workforce Committee: Website News,https://edworkforce.house.gov/news/,,,,,,
House Education and Workforce Committee: Committee Activity,https://www.congress.gov/committee/house-education-and-workforce/hsed00,,,,,,
House Energy and Commerce Committee: Website News,https://energycommerce.house.gov/news/press-release,,,,,,
House Energy and Commerce Committee: Committee Activity,https://www.congress.gov/committee/house-energy-and-commerce/hsif00,,,,,,
House Ethics Committee: Website News,https://ethics.house.gov/press-releases/,,,,,,
House Ethics Committee: Committee Activity,https://www.congress.gov/committee/house-ethics/hsso00,,,,,,
House Financial Services Committee: Website News,https://financialservices.house.gov/news/,,,,,,
House Financial Services Committee: Committee Activity,https://www.congress.gov/committee/house-financial-services/hsba00,,,,,,
House Foreign Affairs Committee: Website News,https://foreignaffairs.house.gov/updates/,,,,,,
House Foreign Affairs Committee: Committee Activity,https://www.congress.gov/committee/house-foreign-affairs/hsfa00,,,,,,
House Homeland Security Committee: Website News,https://homeland.house.gov/press/,,,,,,
House Homeland Security Committee: Committee Activity,https://www.congress.gov/committee/house-homeland-security/hshm00,,,,,,
Committee on House Administration: Website News,https://cha.house.gov/press-releases,,,,,,
Committee on House Administration: Committee Activity,https://www.congress.gov/committee/committee-on-house-administration/hsha00,,,,,,
House Judiciary Committee: Website News,https://judiciary.house.gov/media,,,,,,
House Judiciary Committee: Committee Activity,https://www.congress.gov/committee/house-judiciary/hsju00,,,,,,
House Natural Resources Committee: Website News,https://naturalresources.house.gov/news/documentquery.aspx?DocumentTypeID=1634,,,,,,
House Natural Resources Committee: Committee Activity,https://www.congress.gov/committee/house-natural-resources/hsii00,,,,,,
House Oversight and Government Reform Committee: Website News,https://oversight.house.gov/release/,,,,,,
House Oversight and Government Reform Committee: Committee Activity,https://www.congress.gov/committee/house-oversight-and-government-reform/hsgo00,,,,,,
House Rules Committee: Website News,https://rules.house.gov/media,,,,,,
House Rules Committee: Committee Activity,https://www.congress.gov/committee/house-rules/hsru00,,,,,,
"House Science, Space, and Technology Committee: Website News",https://science.house.gov/press-releases,,,,,,
"House Science, Space, and Technology Committee: Committee Activity",https://www.congress.gov/committee/house-science-space-and-technology/hssy00,,,,,,
House Small Business Committee: Website News,https://smallbusiness.house.gov/news/,,,,,,
House Small Business Committee: Committee Activity,https://www.congress.gov/committee/house-small-business/hssm00,,,,,,
House Transportation and Infrastructure Committee: Website News,https://transportation.house.gov/news/documentquery.aspx?DocumentTypeID=2545,,,,,,
House Transportation and Infrastructure Committee: Committee Activity,https://www.congress.gov/committee/house-transportation-and-infrastructure/hspw00,,,,,,
House Veterans' Affairs Committee: Website News,https://veterans.house.gov/news/,,,,,,
House Veterans' Affairs Committee: Committee Activity,https://www.congress.gov/committee/house-veterans-affairs/hsvr00,,,,,,
House Ways and Means Committee: Website News,https://waysandmeans.house.gov/news/,,,,,,
House Ways and Means Committee: Committee Activity,https://www.congress.gov/committee/house-ways-and-means/hswm00,,,,,,
"Senate Agriculture, Nutrition, and Forestry Committee: Website News",https://www.agriculture.senate.gov/newsroom,,,,,,
"Senate Agriculture, Nutrition, and Forestry Committee: Committee Activity",https://www.congress.gov/committee/senate-agriculture-nutrition-and-forestry/ssaf00,,,,,,
Senate Appropriations Committee: Website News,https://www.appropriations.senate.gov/news/majority,,,,,,
Senate Appropriations Committee: Committee Activity,https://www.congress.gov/committee/senate-appropriations/ssap00,,,,,,
Senate Armed Services Committee: Website News,https://www.armed-services.senate.gov/press-releases,,,,,,
Senate Armed Services Committee: Committee Activity,https://www.congress.gov/committee/senate-armed-services/ssas00,,,,,,
"Senate Banking, Housing, and Urban Affairs Committee: Website News",https://www.banking.senate.gov/newsroom/majority-press-releases,,,,,,
"Senate Banking, Housing, and Urban Affairs Committee: Committee Activity",https://www.congress.gov/committee/senate-banking-housing-and-urban-affairs/ssbk00,,,,,,
Senate Budget Committee: Website News,https://www.budget.senate.gov/,,,,,,
Senate Budget Committee: Committee Activity,https://www.congress.gov/committee/senate-budget/ssbu00,,,,,,
"Senate Commerce, Science, and Transportation Committee: Website News",https://www.commerce.senate.gov/republican-news,,,,,,
"Senate Commerce, Science, and Transportation Committee: Committee Activity",https://www.congress.gov/committee/senate-commerce-science-and-transportation/sscm00,,,,,,
Senate Energy and Natural Resources Committee: Website News,https://www.energy.senate.gov/home,,,,,,
Senate Energy and Natural Resources Committee: Committee Activity,https://www.congress.gov/committee/senate-energy-and-natural-resources/sseg00,,,,,,
Senate Environment and Public Works Committee: Website News,https://www.epw.senate.gov/public/,,,,,,
Senate Environment and Public Works Committee: Committee Activity,https://www.congress.gov/committee/senate-environment-and-public-works/ssev00,,,,,,
Senate Finance Committee: Website News,https://www.finance.senate.gov/,,,,,,
Senate Finance Committee: Committee Activity,https://www.congress.gov/committee/senate-finance/ssfi00,,,,,,
Senate Foreign Relations Committee: Website News,https://www.foreign.senate.gov/press,,,,,,
Senate Foreign Relations Committee: Committee Activity,https://www.congress.gov/committee/senate-foreign-relations/ssfr00,,,,,,
"Senate Health, Education, Labor, and Pensions Committee: Website News",https://www.help.senate.gov/ranking/newsroom/press,,,,,,
"Senate Health, Education, Labor, and Pensions Committee: Committee Activity",https://www.congress.gov/committee/senate-health-education-labor-and-pensions/sshr00,,,,,,
Senate Homeland Security and Governmental Affairs Committee: Website News,https://www.hsgac.senate.gov/media/,,,,,,
Senate Homeland Security and Governmental Affairs Committee: Committee Activity,https://www.congress.gov/committee/senate-homeland-security-and-governmental-affairs/ssga00,,,,,,
Senate Judiciary Committee: Website News,https://www.judiciary.senate.gov/press,,,,,,
Senate Judiciary Committee: Committee Activity,https://www.congress.gov/committee/senate-judiciary/ssju00,,,,,,
Senate Rules and Administration Committee: Website News,https://www.rules.senate.gov/news/press-releases,,,,,,
Senate Rules and Administration Committee: Committee Activity,https://www.congress.gov/committee/senate-rules-and-administration/ssra00,,,,,,
Senate Small Business and Entrepreneurship Committee: Website News,https://www.sbc.senate.gov/public/,,,,,,
Senate Small Business and Entrepreneurship Committee: Committee Activity,https://www.congress.gov/committee/senate-small-business-and-entrepreneurship/sssb00,,,,,,
Senate Veterans' Affairs Committee: Website News,https://www.veterans.senate.gov/,,,,,,
Senate Veterans' Affairs Committee: Committee Activity,https://www.congress.gov/committee/senate-veterans-affairs/ssva00,,,,,,
House Permanent Select Committee on Intelligence: Website News,https://intelligence.house.gov/news/,,,,,,
House Permanent Select Committee on Intelligence: Committee Activity,https://www.congress.gov/committee/house-intelligence-permanent-select/hlig00,,,,,,
Select Committee on the Strategic Competition Between the United States and the Chinese Communist Party: Website News,https://selectcommitteeontheccp.house.gov/media,,,,,,
Select Committee on the Strategic Competition Between the United States and the Chinese Communist Party: Committee Activity,https://www.congress.gov/committee/house-select-committee-on-the-strategic-competition-between-the-united-states-and-the-chinese-communist-party/hlzs00,,,,,,
Senate Aging (Special) Committee: Website News,https://www.aging.senate.gov/press-room/press-releases,,,,,,
Senate Aging (Special) Committee: Committee Activity,https://www.congress.gov/committee/senate-aging-special/spag00,,,,,,
United States Senate Caucus on International Narcotics Control: Website News,https://www.drugcaucus.senate.gov/media-center/press-releases/,,,,,,
United States Senate Caucus on International Narcotics Control: Committee Activity,https://www.congress.gov/committee/senate-caucus-on-international-narcotics-control/scnc00,,,,,,
Senate Ethics (Select) Committee: Website News,https://www.ethics.senate.gov/public/index.cfm/pressreleases,,,,,,
Senate Ethics (Select) Committee: Committee Activity,https://www.congress.gov/committee/senate-ethics-select/slet00,,,,,,
Senate Indian Affairs Committee: Website News,https://www.indian.senate.gov/newsroom/,,,,,,
Senate Indian Affairs Committee: Committee Activity,https://www.congress.gov/committee/senate-indian-affairs/slia00,,,,,,
Senate Intelligence (Select) Committee: Website News,https://www.intelligence.senate.gov/press,,,,,,
Senate Intelligence (Select) Committee: Committee Activity,https://www.congress.gov/committee/senate-intelligence-select/slin00,,,,,,
Joint Committee on Printing: Website News,https://cha.house.gov/press-releases,,,,,,
Joint Committee on Printing: Committee Activity,https://www.congress.gov/committee/joint-committee-on-printing/jspr00,,,,,,
Joint Committee on Taxation: Website News,https://www.jct.gov/publications/?searchmode=anyword&searchtext=&topicid=0&pubid=&pubdtfrom=&pubdtto=,,,,,,
Joint Committee on Taxation: Committee Activity,https://www.congress.gov/committee/joint-committee-on-taxation/jstx00,,,,,,
Joint Committee on the Library: Website News,https://cha.house.gov/press-releases,,,,,,
Joint Committee on the Library: Committee Activity,https://www.congress.gov/committee/joint-committee-on-the-library/jslc00,,,,,,
Joint Economic Committee: Website News,https://www.jec.senate.gov/public/,,,,,,
Joint Economic Committee: Committee Activity,https://www.congress.gov/committee/joint-economic-committee/jsec00,,,,,,
Commission on Security and Cooperation in Europe (U.S. Helsinki Commission): Website News,https://www.csce.gov/,,,,,,
Commission on Security and Cooperation in Europe (U.S. Helsinki Commission): Committee Activity,https://www.congress.gov/committee/commission-on-security-and-cooperation-in-europe-u-s-helsinki-commission/jcse00,,,,,,
Congressional-Executive Commission on China: Website News,https://www.cecc.gov/,,,,,,
Congressional-Executive Commission on China: Committee Activity,https://www.congress.gov/committee/congressional-executive-commission-on-china/jcpk00,,,,,,
Congressional Oversight Commission: Website News,https://coc.senate.gov/,,,,,,
Congressional Oversight Commission: Committee Activity,https://www.congress.gov/committee/congressional-oversight-commission/jcov00,,,,,,
The Hill,https://thehill.com/,,,,,,
Newsmax,https://www.newsmax.com/,,,,,,
The Heritage Foundation,https://www.heritage.org/,,,,,,
The Daily Signal,https://www.dailysignal.com/,,,,,,
Hudson Institute,https://www.hudson.org/,,,,,,
Claremont Institute,https://www.claremont.org/media/,,,,,,
City Journal,https://www.city-journal.org/,,,,,,
Organization for Security and Co-operation in Europe,https://www.osce.org/press-releases,,,,,,
Wilson Center,https://www.wilsoncenter.org/insight-analysis,,,,,,
Peace Research Institute Frankfurt,https://www.prif.org/en/publications,,,,,,
North Atlantic Treaty Organization,https://www.nato.int/cps/en/natohq/news.htm,,,,,,
Rappler,https://www.rappler.com/,,,,,,
European Union,https://european-union.europa.eu/news-and-events/news-and-stories_en,,,,,,
International Institute for Strategic Studies,https://www.iiss.org/,,,,,,
Fundación Ideas para la Paz,https://ideaspaz.org/publicaciones?refinementList%5Bcontent_type%5D%5B0%5D=,,,,,,
Centre for Humanitarian Dialogue,https://hdcentre.org/news/,,,,,,
Washington Post Fact Checker,https://www.washingtonpost.com/politics/fact-checker/,,fact check,,,,
Fact Check: SciCheck,https://www.factcheck.org/scicheck/,,fact check,,,,
NPR FactCheck,https://www.npr.org/sections/politics-fact-check,,fact check,,,,
Africa Check,https://africacheck.org/fact-checks,,fact check,,,,
Dubawa,https://dubawa.org/category/fact-check/,,,,,,
Middle East Institute,https://www.mei.edu/policy-analysis,,,,,,
Bipartisan Policy Center,https://bipartisanpolicy.org/all-content/?recent=30,,,,,,
The Conference Board ,https://www.conference-board.org/publications,,,,,,
Center for a New American Security,https://www.cnas.org/reports,,,,,,
Resources for the Future,https://www.rff.org/publications/all-publications/,,,,,,
New America,https://www.newamerica.org/publications/,,,,,,
Stimson Center,https://www.stimson.org/,,,,,,
Manhattan Institute for Policy Research,https://manhattan.institute/articles,,,,,,
Hoover Institution: Research,https://www.hoover.org/research#filter,,,,,,
Hoover Institution: Commentary,https://www.hoover.org/commentary#filter,,,,,,
Foreign Policy Research Institute,https://www.fpri.org/,,,,,,
Center for American Progress,https://www.americanprogress.org/,,,,,,
Urban Institute,https://www.urban.org/research,,,,,,
Atlantic Council,https://www.atlanticcouncil.org/in-depth-research-reports/,,,,,,
Joint Center for Political and Economic Studies,https://jointcenter.org/tag/data-and-research/,,,,,,
National Bureau of Economic Research,https://www.nber.org/nber-news/featured-working-papers-archive?page=1&perPage=50,,,,,,
Foundation for Economic Education,https://fee.org/commentary/,,,,,,
Al-Shabaka,https://al-shabaka.org/analysis/,,,,,,
Competitive Enterprise Institute,https://cei.org/blog/,,,,,,
U.S. Council on Competitiveness,https://compete.org/news-updates/,,,,,,
Employment Policies Institute,https://epionline.org/,,,,,,
Ethics and Public Policy Center,https://eppc.org/publication/,,,,,,
Center for Democracy and Technology,https://cdt.org/insights/,,,,,,
Institute for New Economic Thinking: Papers,https://www.ineteconomics.org/research/research-papers,,,,,,
Institute for New Economic Thinking: Blog,https://www.ineteconomics.org/perspectives/blog,,,,,,
Democracy Forward,https://democracyforward.org/updates/,,,w,,,
Institute for Justice,https://ij.org/news/,,,,,,
Project on Government Oversight: Reports and Analysis,https://www.pogo.org/reports-analyses-index,,,,,,
Project on Government Oversight: Investigations,https://www.pogo.org/investigations,,,,,,
American Civil Liberties Union,https://www.aclu.org/news,,,,,,
Human Rights Watch,https://www.hrw.org/publications,,,,,,
Southern Poverty Law Center,https://www.splcenter.org/resources/stories/,,,,,,
Electronic Frontier Foundation,https://www.eff.org/updates,,,,,,
American Center for Law & Justice,https://aclj.org/news,,,,,,
Center for Constitutional Rights,https://ccrjustice.org/home/press-center/press-releases/search,,,,,,
Better Government Association,https://www.bettergov.org/category/policy/research-analysis/,,,,,,
Center for Public Integrity,https://publicintegrity.org/archive/,,,,,,
Council of the Inspectors General on Integrity and Efficiency,https://www.ignet.gov/content/newsroom,,,,,,
The Financial Accountability and Corporate Transparency Coalition,https://thefactcoalition.org/news-events/,,,,,,
OpenSecrets,https://www.opensecrets.org/news/,,,,,,
Ballotpedia News,https://news.ballotpedia.org/,,,,,,
Ballotpedia,https://ballotpedia.org/Main_Page,,,,,,
Public Citizen,https://www.citizen.org/news/,,,,,,
Tax Foundation: Blog,https://taxfoundation.org/blog,,,,,,
Tax Foundation: Testimony,https://taxfoundation.org/testimony/,,,,,,
Tax Foundation: Op-eds,https://taxfoundation.org/op-eds/,,,,,,
American Economic Association: American Economic Review,https://www.aeaweb.org/journals/aer/research-highlights,,,,,,
The Kyiv Independent,https://kyivindependent.com/,,,,,,
Sputnik,https://sputnikglobe.com/,,,,,,
Documented,https://documented.net/reporting,,,,,,
Foreign Policy,https://foreignpolicy.com/,,,,,,
Due Process of Law Foundation: Blog,https://dplf.org/en/blog/,,,,,,
Due Process of Law Foundation: Publications,https://dplf.org/en/publications-dplf/,,,,,,
Peterson Institute for International Economics,https://www.piie.com/search?search_api_fulltext=&sort_by=field_date,,,,,,
Duke: Reporter's Lab,https://reporterslab.org/,,,,,,
Inside Precision Medicine,https://www.insideprecisionmedicine.com/,,,,,,
National Institute of Standards and Technology,https://www.nist.gov/publications,,,,,,
Deloitte Research Center for Energy & Industrials,https://www2.deloitte.com/us/en/insights/research-centers/center-energy-industrials.html,,,,,,
National Science Foundation,https://www.nsf.gov/news,,,,,,
Ames National Laboratory,https://www.ameslab.gov/,,,,,,
Argonne National Laboratory,https://www.anl.gov/,,,,,,
Brookhaven National Laboratory,https://www.bnl.gov/newsroom/,,,,,,
